key,type,description,priority,estimatedDuration,key:technician,key:aircraft
task-01,MAINTENANCE,L,0,0,technician-01,aircraft-01
task-02,INSPECTION,Lo,1,1,technician-02,aircraft-02
task-03,REPAIR,天飽雲馬消根清歡寫尾做兒幫,5,500,technician-01,aircraft-03
task-04,SYSTEM_CHECK,Lorem ipsum dolor sit amet consectetur adipiscing elit. Sed do: eiusmod tempor incididunt ut labore et dolore magna aliqua! Ut enim ad minim veniam? Quis nostrud exercitation ullamco laboris nisi ut aliquip ex ea commodo consequat. Duis aute irure dolor*,9,999,technician-02,aircraft-04
task-05,MAINTENANCE,Lorem ipsum dolor sit amet consectetur adipiscing elit. Sed do: eiusmod tempor incididunt ut labore et dolore magna aliqua! Ut enim ad minim veniam? Quis nostrud exercitation ullamco laboris nisi ut aliquip ex ea commodo consequat. Duis aute irure dolor**,10,1000,technician-01,aircraft-05